{
  "checks": [
    {
      "name": "semver_version",
      "observed": "1.0.3",
      "passed": true,
      "required": "MAJOR.MINOR.PATCH"
    },
    {
      "name": "top_level_api",
      "observed": {
        "count": 20,
        "missing": []
      },
      "passed": true,
      "required": "tracerazor.__all__ resolves"
    },
    {
      "name": "trice_api",
      "observed": {
        "count": 139,
        "missing": []
      },
      "passed": true,
      "required": "tracerazor.trice.__all__ resolves"
    },
    {
      "name": "cli_contract",
      "observed": [
        "artifact",
        "bundle",
        "claim",
        "contract",
        "crates",
        "design",
        "doctor",
        "install",
        "integrity",
        "protocol",
        "release",
        "release-evidence",
        "reproduction",
        "research",
        "run",
        "schema",
        "suite",
        "validate-adapter",
        "validate-patch",
        "validate-receipt",
        "validate-suite",
        "verify",
        "verify-artifact",
        "verify-bundle",
        "verify-claim",
        "verify-contract",
        "verify-crates",
        "verify-design",
        "verify-install",
        "verify-integrity",
        "verify-protocol",
        "verify-release",
        "verify-release-evidence",
        "verify-reproduction",
        "verify-research",
        "verify-suite"
      ],
      "passed": true,
      "required": "all documented tracerazor-trice commands exist"
    },
    {
      "name": "schemas_shipped",
      "observed": "19/19",
      "passed": true,
      "required": "all TRICE JSON Schemas are present"
    },
    {
      "name": "contract_schema_shipped",
      "observed": "trice_contract_card.schema.json",
      "passed": true,
      "required": "contract-card schema ships"
    },
    {
      "name": "examples_shipped",
      "observed": "9/9",
      "passed": true,
      "required": "public examples are present"
    },
    {
      "name": "docs_shipped",
      "observed": "5/5",
      "passed": true,
      "required": "README/library/research/trust docs are present"
    }
  ],
  "cli": {
    "commands": [
      "artifact",
      "bundle",
      "claim",
      "contract",
      "crates",
      "design",
      "doctor",
      "install",
      "integrity",
      "protocol",
      "release",
      "release-evidence",
      "reproduction",
      "research",
      "run",
      "schema",
      "suite",
      "validate-adapter",
      "validate-patch",
      "validate-receipt",
      "validate-suite",
      "verify",
      "verify-artifact",
      "verify-bundle",
      "verify-claim",
      "verify-contract",
      "verify-crates",
      "verify-design",
      "verify-install",
      "verify-integrity",
      "verify-protocol",
      "verify-release",
      "verify-release-evidence",
      "verify-reproduction",
      "verify-research",
      "verify-suite"
    ],
    "entrypoint": "tracerazor-trice",
    "missing": [],
    "required": [
      "run",
      "suite",
      "verify",
      "verify-suite",
      "bundle",
      "verify-bundle",
      "doctor",
      "claim",
      "verify-claim",
      "artifact",
      "verify-artifact",
      "protocol",
      "verify-protocol",
      "design",
      "verify-design",
      "reproduction",
      "verify-reproduction",
      "release",
      "verify-release",
      "release-evidence",
      "verify-release-evidence",
      "integrity",
      "verify-integrity",
      "research",
      "verify-research",
      "crates",
      "verify-crates",
      "install",
      "verify-install",
      "contract",
      "verify-contract",
      "schema",
      "validate-patch",
      "validate-adapter",
      "validate-receipt",
      "validate-suite"
    ],
    "sha256": "8fd82b16299fb1eef8dc6138d0e8f68031bb7a8fe9f6edd880ab0d969fac7ccb",
    "source": "tracerazor/trice/cli.py"
  },
  "contract_card_sha256": "dc9a3946bd06877f1585eb57075043b5ed4d3cc1d9a0d06134e09994a524a4f6",
  "contract_level": "library_contract_locked",
  "contract_score": 100,
  "examples": [
    {
      "bytes": 427,
      "name": "trice_adapter_profile_bundled_tasks.json",
      "path": "examples/trice_adapter_profile_bundled_tasks.json",
      "present": true,
      "sha256": "675ca98c9304ba17bde93e450759eab6a9b00926dd5dc8b2bab2e46f76fb7611"
    },
    {
      "bytes": 391,
      "name": "trice_adapter_profile_echo.json",
      "path": "examples/trice_adapter_profile_echo.json",
      "present": true,
      "sha256": "e6772d0615abba2b43bf6b2df09bee2b9f1a8ec47b45dd6b32a6a22466fe74dd"
    },
    {
      "bytes": 190,
      "name": "trice_patch_fix_offbyone.json",
      "path": "examples/trice_patch_fix_offbyone.json",
      "present": true,
      "sha256": "de5bd5e413ec3ac9651a11dbd6a6fb1a158442bede9804d5a1e94592d7aa72f1"
    },
    {
      "bytes": 460,
      "name": "trice_remote_smoke_patch.json",
      "path": "examples/trice_remote_smoke_patch.json",
      "present": true,
      "sha256": "8929691e6a0c91eeb1ab603e41cb5f8dba86e4e5d0154fe13160c5c2232dc131"
    },
    {
      "bytes": 1139,
      "name": "trice_remote_smoke_source.json",
      "path": "examples/trice_remote_smoke_source.json",
      "present": true,
      "sha256": "7a7e62632f4e107377c6a208b786b0877f9e45c3d558363d31f426ac46ccbf2b"
    },
    {
      "bytes": 1208,
      "name": "trice_remote_smoke_suite.json",
      "path": "examples/trice_remote_smoke_suite.json",
      "present": true,
      "sha256": "a5f595fa17212e05a59cbb3dce4bc18166db17dee063a592ef17236eac5fb319"
    },
    {
      "bytes": 4758,
      "name": "trice_repair_bundled_tasks.py",
      "path": "examples/trice_repair_bundled_tasks.py",
      "present": true,
      "sha256": "d5192c9284069bd6a49074726ea9769923d914bc58dac403e21e36c0572f9a66"
    },
    {
      "bytes": 2066,
      "name": "trice_suite_bundled_live.json",
      "path": "examples/trice_suite_bundled_live.json",
      "present": true,
      "sha256": "fd4335bea5164e4e0dd479ff5154947c54941d9c9704258b018b51c172a7859b"
    },
    {
      "bytes": 510,
      "name": "trice_suite_fix_offbyone.json",
      "path": "examples/trice_suite_fix_offbyone.json",
      "present": true,
      "sha256": "21c446d2d34761a8cc3b9f44f9c0077617de33bf66a23621cecc14bad8e6a10d"
    }
  ],
  "inputs": {
    "library_doc": {
      "bytes": 24295,
      "name": "trice_library.md",
      "path": "docs/trice_library.md",
      "present": true,
      "sha256": "a256eb788c0dc9c04a976e19e1ca0f8a788c2c5b03e2b8433f3114cff55524bf"
    },
    "public_trust_matrix": {
      "bytes": 11212,
      "name": "public_trust_matrix.md",
      "path": "docs/public_trust_matrix.md",
      "present": true,
      "sha256": "c5b0b5173a8efbe35ce1526401a5a6b88c0813d92d6625eac7d3055813b614b5"
    },
    "pyproject": {
      "bytes": 5850,
      "name": "pyproject.toml",
      "path": "pyproject.toml",
      "present": true,
      "sha256": "a59e14dfdd4c752e93403818f1a4b32c2ccb1bae577132d7f6e6aef53865d1a3"
    },
    "readme": {
      "bytes": 84701,
      "name": "README.md",
      "path": "README.md",
      "present": true,
      "sha256": "61cb955903b1ef2a0c3684407111a836b8a130c8d6f36f1280bdd2994fbe478b"
    },
    "research_ledger": {
      "bytes": 35605,
      "name": "trice_research_ledger.md",
      "path": "docs/trice_research_ledger.md",
      "present": true,
      "sha256": "fd4bd4a9e466a6ce3100cb0ebc9e10f17b307109eafed2f1f1aaff4c7e5f5236"
    }
  },
  "next_actions": [
    "Treat this card as the public API boundary for SemVer compatibility.",
    "Regenerate the contract card before every release and after any public API, CLI, schema, or example change.",
    "Promote only documented imports and schemas into long-term compatibility guarantees."
  ],
  "package": "tracerazor",
  "public_api": {
    "tracerazor": {
      "count": 20,
      "exports": [
        "Tracer",
        "TraceRazorClient",
        "TraceRazorReport",
        "TraceStep",
        "AdaptiveKNode",
        "ExactMatchConsensus",
        "ConsensusReport",
        "MutationMetadata",
        "NaiveKEnsemble",
        "NaiveRunResult",
        "SelfConsistencyBaseline",
        "SCResult",
        "BranchProposal",
        "ConsensusResult",
        "Outcome",
        "StepRecord",
        "TokenCounts",
        "openai_llm",
        "anthropic_llm",
        "mock_llm"
      ],
      "missing": [],
      "module": "tracerazor"
    },
    "tracerazor.trice": {
      "count": 139,
      "exports": [
        "ActionCandidate",
        "BundleManifest",
        "ClaimGate",
        "CommandRepairAdapter",
        "ConfidenceInterval",
        "ContextPolicy",
        "EvidenceManifest",
        "EvidenceRecallReport",
        "JsonPatchAdapter",
        "LearningWeights",
        "LiveRolloutResult",
        "LiveRound",
        "LiveTask",
        "PatchEdit",
        "PolicyDecision",
        "PolicyUpdate",
        "ReplayMetrics",
        "RepairAdapter",
        "ScoreWeights",
        "Segment",
        "SegmentScore",
        "SegmentState",
        "SuiteRunResult",
        "SuiteTaskRun",
        "SuiteTaskSpec",
        "TreeFingerprint",
        "UserPreferenceProfile",
        "bootstrap_mean_ci",
        "build_manifest",
        "build_crates_card",
        "build_integrity_card",
        "build_install_card",
        "build_claim_card",
        "build_artifact_card",
        "build_contract_card",
        "build_design_card",
        "build_protocol_lock",
        "build_release_card",
        "build_release_evidence_card",
        "build_reproduction_card",
        "build_research_card",